Label,Subject,Subject URI,Predicate,Predicate URI,Object,Object URI
"By 2030, reduce at least by half the proportion of men, women and children of all ages living in poverty in all its dimensions according to national definitions",sdg:1.2,http://metadata.un.org/sdg/1.2,skos:narrower,http://www.w3.org/2004/02/skos/core#narrower,sdg:C010201,http://metadata.un.org/sdg/C010201
"By 2030, achieve universal and equitable access to safe and affordable drinking water for all",sdg:6.1,http://metadata.un.org/sdg/6.1,skos:broader,http://www.w3.org/2004/02/skos/core#broader,sdg:6,http://metadata.un.org/sdg/6
"Improve education, awareness-raising and human and institutional capacity on climate change mitigation, adaptation, impact reduction and early warning",sdg:13.3,http://metadata.un.org/sdg/13.3,skos:broader,http://www.w3.org/2004/02/skos/core#broader,sdg:13,http://metadata.un.org/sdg/13
"Rationalize inefficient fossil-fuel subsidies that encourage wasteful consumption by removing market distortions, in accordance with national circumstances, including by restructuring taxation and phasing out those harmful subsidies, where they exist, to reflect their environmental impacts, taking fully into account the specific needs and conditions of developing countries and minimizing the possible adverse impacts on their development in a manner that protects the poor and the affected communities",sdg:12.c,http://metadata.un.org/sdg/12.c,sdgo:hasIndicator,http://metadata.un.org/sdg/ontology#hasIndicator,sdg:C120c01,http://metadata.un.org/sdg/C120c01
"By 2030, ensure equal access for all women and men to affordable and quality technical, vocational and tertiary education, including university",sdg:4.3,http://metadata.un.org/sdg/4.3,skos:narrower,http://www.w3.org/2004/02/skos/core#narrower,sdg:C040301,http://metadata.un.org/sdg/C040301
"Ensure responsive, inclusive, participatory and representative decision-making at all levels",sdg:16.7,http://metadata.un.org/sdg/16.7,sdgo:hasIndicator,http://metadata.un.org/sdg/ontology#hasIndicator,sdg:C160701,http://metadata.un.org/sdg/C160701
"Protect, restore and promote sustainable use of terrestrial ecosystems, sustainably manage forests, combat desertification, and halt and reverse land degradation and halt biodiversity loss",sdg:15,http://metadata.un.org/sdg/15,skos:narrower,http://www.w3.org/2004/02/skos/core#narrower,sdg:15.2,http://metadata.un.org/sdg/15.2
"Make cities and human settlements inclusive, safe, resilient and sustainable",sdg:11,http://metadata.un.org/sdg/11,sdgo:hasTarget,http://metadata.un.org/sdg/ontology#hasTarget,sdg:11.7,http://metadata.un.org/sdg/11.7
Ensure inclusive and equitable quality education and promote lifelong learning opportunities for all,sdg:4,http://metadata.un.org/sdg/4,skos:narrower,http://www.w3.org/2004/02/skos/core#narrower,sdg:4.1,http://metadata.un.org/sdg/4.1
Proportion of countries adopting relevant national legislation and adequately resourcing the prevention or control of invasive alien species,sdg:C150801,http://metadata.un.org/sdg/C150801,skos:broader,http://www.w3.org/2004/02/skos/core#broader,sdg:15.8,http://metadata.un.org/sdg/15.8
"By 2030, expand international cooperation and capacity-building support to developing countries in water- and sanitation-related activities and programmes, including water harvesting, desalination, water efficiency, wastewater treatment, recycling and reuse technologies",sdg:6.a,http://metadata.un.org/sdg/6.a,skos:broader,http://www.w3.org/2004/02/skos/core#broader,sdg:6,http://metadata.un.org/sdg/6
"Prevalence of malnutrition (weight for height >+2 or <-2 standard deviation from the median of the WHO Child Growth Standards) among children under 5 years of age, by type (wasting and overweight)",sdg:C020202,http://metadata.un.org/sdg/C020202,sdgo:isIndicatorOf,http://metadata.un.org/sdg/ontology#isIndicatorOf,sdg:2.2,http://metadata.un.org/sdg/2.2
Recruitment cost borne by employee as a proportion of monthly income earned in country of destination,sdg:C100701,http://metadata.un.org/sdg/C100701,sdgo:isIndicatorOf,http://metadata.un.org/sdg/ontology#isIndicatorOf,sdg:10.7,http://metadata.un.org/sdg/10.7
"Enhance the Global Partnership for Sustainable Development, complemented by multi-stakeholder partnerships that mobilize and share knowledge, expertise, technology and financial resources, to support the achievement of the Sustainable Development Goals in all countries, in particular developing countries",sdg:17.16,http://metadata.un.org/sdg/17.16,skos:broader,http://www.w3.org/2004/02/skos/core#broader,sdg:17,http://metadata.un.org/sdg/17
"Enhance global support for efforts to combat poaching and trafficking of protected species, including by increasing the capacity of local communities to pursue sustainable livelihood opportunities",sdg:15.c,http://metadata.un.org/sdg/15.c,skos:narrower,http://www.w3.org/2004/02/skos/core#narrower,sdg:C200206,http://metadata.un.org/sdg/C200206
Existence of independent national human rights institutions in compliance with the Paris Principles,sdg:C160a01,http://metadata.un.org/sdg/C160a01,skos:broader,http://www.w3.org/2004/02/skos/core#broader,sdg:16.a,http://metadata.un.org/sdg/16.a
"Improve education, awareness-raising and human and institutional capacity on climate change mitigation, adaptation, impact reduction and early warning",sdg:13.3,http://metadata.un.org/sdg/13.3,skos:narrower,http://www.w3.org/2004/02/skos/core#narrower,sdg:C130302,http://metadata.un.org/sdg/C130302
"By 2030, implement integrated water resources management at all levels, including through transboundary cooperation as appropriate",sdg:6.5,http://metadata.un.org/sdg/6.5,sdgo:isTargetOf,http://metadata.un.org/sdg/ontology#isTargetOf,sdg:6,http://metadata.un.org/sdg/6
Proportion of countries with systems to track and make public allocations for gender equality and women’s empowerment,sdg:C050c01,http://metadata.un.org/sdg/C050c01,sdgo:isIndicatorOf,http://metadata.un.org/sdg/ontology#isIndicatorOf,sdg:5.c,http://metadata.un.org/sdg/5.c
"By 2030, ensure sustainable food production systems and implement resilient agricultural practices that increase productivity and production, that help maintain ecosystems, that strengthen capacity for adaptation to climate change, extreme weather, drought, flooding and other disasters and that progressively improve land and soil quality",sdg:2.4,http://metadata.un.org/sdg/2.4,sdgo:isTargetOf,http://metadata.un.org/sdg/ontology#isTargetOf,sdg:2,http://metadata.un.org/sdg/2
"Domestic material consumption, domestic material consumption per capita,  and domestic material consumption per GDP",sdg:C200203,http://metadata.un.org/sdg/C200203,skos:broader,http://www.w3.org/2004/02/skos/core#broader,sdg:8.4,http://metadata.un.org/sdg/8.4
Mobilize and significantly increase financial resources from all sources to conserve and sustainably use biodiversity and ecosystems,sdg:15.a,http://metadata.un.org/sdg/15.a,skos:broader,http://www.w3.org/2004/02/skos/core#broader,sdg:15,http://metadata.un.org/sdg/15
"Improve progressively, through 2030, global resource efficiency in consumption and production and endeavour to decouple economic growth from environmental degradation, in accordance with the 10‑Year Framework of Programmes on Sustainable Consumption and Production, with developed countries taking the lead",sdg:8.4,http://metadata.un.org/sdg/8.4,sdgo:hasIndicator,http://metadata.un.org/sdg/ontology#hasIndicator,sdg:C200203,http://metadata.un.org/sdg/C200203
"By 2030, ensure that all learners acquire the knowledge and skills needed to promote sustainable development, including, among others, through education for sustainable development and sustainable lifestyles, human rights, gender equality, promotion of a culture of peace and non-violence, global citizenship and appreciation of cultural diversity and of culture’s contribution to sustainable development",sdg:4.7,http://metadata.un.org/sdg/4.7,sdgo:hasIndicator,http://metadata.un.org/sdg/ontology#hasIndicator,sdg:C040701,http://metadata.un.org/sdg/C040701
Significantly reduce all forms of violence and related death rates everywhere,sdg:16.1,http://metadata.un.org/sdg/16.1,sdgo:hasIndicator,http://metadata.un.org/sdg/ontology#hasIndicator,sdg:C160102,http://metadata.un.org/sdg/C160102
Growth rates of household expenditure or income per capita among the bottom 40 per cent of the population and the total population,sdg:C100101,http://metadata.un.org/sdg/C100101,skos:broader,http://www.w3.org/2004/02/skos/core#broader,sdg:10.1,http://metadata.un.org/sdg/10.1
Death rate due to road traffic injuries,sdg:C030601,http://metadata.un.org/sdg/C030601,sdgo:isIndicatorOf,http://metadata.un.org/sdg/ontology#isIndicatorOf,sdg:3.6,http://metadata.un.org/sdg/3.6
Achieve gender equality and empower all women and girls,sdg:5,http://metadata.un.org/sdg/5,skos:narrower,http://www.w3.org/2004/02/skos/core#narrower,sdg:5.5,http://metadata.un.org/sdg/5.5
"Promote fair and equitable sharing of the benefits arising from the utilization of genetic resources and promote appropriate access to such resources, as internationally agreed",sdg:15.6,http://metadata.un.org/sdg/15.6,skos:broader,http://www.w3.org/2004/02/skos/core#broader,sdg:15,http://metadata.un.org/sdg/15
Strengthen the means of implementation and revitalize the Global Partnership for Sustainable Development,sdg:17,http://metadata.un.org/sdg/17,sdgo:hasTarget,http://metadata.un.org/sdg/ontology#hasTarget,sdg:17.8,http://metadata.un.org/sdg/17.8
"Proportion of population covered by a mobile network, by technology",sdg:C090c01,http://metadata.un.org/sdg/C090c01,sdgo:isIndicatorOf,http://metadata.un.org/sdg/ontology#isIndicatorOf,sdg:9.c,http://metadata.un.org/sdg/9.c
"Develop quality, reliable, sustainable and resilient infrastructure, including regional and transborder infrastructure, to support economic development and human well-being, with a focus on affordable and equitable access for all",sdg:9.1,http://metadata.un.org/sdg/9.1,skos:narrower,http://www.w3.org/2004/02/skos/core#narrower,sdg:C090102,http://metadata.un.org/sdg/C090102
Ensure sustainable consumption and production patterns,sdg:12,http://metadata.un.org/sdg/12,sdgo:hasTarget,http://metadata.un.org/sdg/ontology#hasTarget,sdg:12.5,http://metadata.un.org/sdg/12.5
"Build resilient infrastructure, promote inclusive and sustainable industrialization and foster innovation",sdg:9,http://metadata.un.org/sdg/9,sdgo:hasTarget,http://metadata.un.org/sdg/ontology#hasTarget,sdg:9.4,http://metadata.un.org/sdg/9.4
End all forms of discrimination against all women and girls everywhere,sdg:5.1,http://metadata.un.org/sdg/5.1,sdgo:hasIndicator,http://metadata.un.org/sdg/ontology#hasIndicator,sdg:C050101,http://metadata.un.org/sdg/C050101
Debt service as a proportion of exports of goods and services,sdg:C170401,http://metadata.un.org/sdg/C170401,skos:broader,http://www.w3.org/2004/02/skos/core#broader,sdg:17.4,http://metadata.un.org/sdg/17.4
"Substantially increase health financing and the recruitment, development, training and retention of the health workforce in developing countries, especially in least developed countries and small island developing States",sdg:3.c,http://metadata.un.org/sdg/3.c,sdgo:isTargetOf,http://metadata.un.org/sdg/ontology#isTargetOf,sdg:3,http://metadata.un.org/sdg/3
"By 2030, end all forms of malnutrition, including achieving, by 2025, the internationally agreed targets on stunting and wasting in children under 5 years of age, and address the nutritional needs of adolescent girls, pregnant and lactating women and older persons",sdg:2.2,http://metadata.un.org/sdg/2.2,skos:narrower,http://www.w3.org/2004/02/skos/core#narrower,sdg:C020201,http://metadata.un.org/sdg/C020201
Proportion of fish stocks within biologically sustainable levels,sdg:C140401,http://metadata.un.org/sdg/C140401,skos:broader,http://www.w3.org/2004/02/skos/core#broader,sdg:14.4,http://metadata.un.org/sdg/14.4
"Support least developed countries, including through financial and technical assistance, in building sustainable and resilient buildings utilizing local materials",sdg:11.c,http://metadata.un.org/sdg/11.c,skos:narrower,http://www.w3.org/2004/02/skos/core#narrower,sdg:C110c01,http://metadata.un.org/sdg/C110c01
"Conserve and sustainably use the oceans, seas and marine resources for sustainable development",sdg:14,http://metadata.un.org/sdg/14,skos:narrower,http://www.w3.org/2004/02/skos/core#narrower,sdg:14.5,http://metadata.un.org/sdg/14.5
"Promote peaceful and inclusive societies for sustainable development, provide access to justice for all and build effective, accountable and inclusive institutions at all levels",sdg:16,http://metadata.un.org/sdg/16,sdgo:hasTarget,http://metadata.un.org/sdg/ontology#hasTarget,sdg:16.7,http://metadata.un.org/sdg/16.7
"By 2020, prohibit certain forms of fisheries subsidies which contribute to overcapacity and overfishing, eliminate subsidies that contribute to illegal, unreported and unregulated fishing and refrain from introducing new such subsidies, recognizing that appropriate and effective special and differential treatment for developing and least developed countries should be an integral part of the World Trade Organization fisheries subsidies negotiation3",sdg:14.6,http://metadata.un.org/sdg/14.6,sdgo:hasIndicator,http://metadata.un.org/sdg/ontology#hasIndicator,sdg:C140601,http://metadata.un.org/sdg/C140601
"Conserve and sustainably use the oceans, seas and marine resources for sustainable development",sdg:14,http://metadata.un.org/sdg/14,skos:narrower,http://www.w3.org/2004/02/skos/core#narrower,sdg:14.6,http://metadata.un.org/sdg/14.6
"Proportion of population who believe decision-making is inclusive and responsive, by sex, age, disability and population group",sdg:C160702,http://metadata.un.org/sdg/C160702,sdgo:isIndicatorOf,http://metadata.un.org/sdg/ontology#isIndicatorOf,sdg:16.7,http://metadata.un.org/sdg/16.7
"Promote peaceful and inclusive societies for sustainable development, provide access to justice for all and build effective, accountable and inclusive institutions at all levels",sdg:16,http://metadata.un.org/sdg/16,sdgo:hasTarget,http://metadata.un.org/sdg/ontology#hasTarget,sdg:16.1,http://metadata.un.org/sdg/16.1
"Enhance global macroeconomic stability, including through policy coordination and policy coherence",sdg:17.13,http://metadata.un.org/sdg/17.13,skos:broader,http://www.w3.org/2004/02/skos/core#broader,sdg:17,http://metadata.un.org/sdg/17
Coverage of protected areas in relation to marine areas,sdg:C140501,http://metadata.un.org/sdg/C140501,sdgo:isIndicatorOf,http://metadata.un.org/sdg/ontology#isIndicatorOf,sdg:14.5,http://metadata.un.org/sdg/14.5
"Minimize and address the impacts of ocean acidification, including through enhanced scientific cooperation at all levels",sdg:14.3,http://metadata.un.org/sdg/14.3,skos:broader,http://www.w3.org/2004/02/skos/core#broader,sdg:14,http://metadata.un.org/sdg/14
"Proportion of children and young people (a) in grades 2/3; (b) at the end of primary; and (c) at the end of lower secondary achieving at least a minimum proficiency level in (i) reading and (ii) mathematics, by sex",sdg:C040101,http://metadata.un.org/sdg/C040101,sdgo:isIndicatorOf,http://metadata.un.org/sdg/ontology#isIndicatorOf,sdg:4.1,http://metadata.un.org/sdg/4.1
"Protect, restore and promote sustainable use of terrestrial ecosystems, sustainably manage forests, combat desertification, and halt and reverse land degradation and halt biodiversity loss",sdg:15,http://metadata.un.org/sdg/15,sdgo:hasTarget,http://metadata.un.org/sdg/ontology#hasTarget,sdg:15.c,http://metadata.un.org/sdg/15.c
"End hunger, achieve food security and improved nutrition and promote sustainable agriculture",sdg:2,http://metadata.un.org/sdg/2,sdgo:hasTarget,http://metadata.un.org/sdg/ontology#hasTarget,sdg:2.2,http://metadata.un.org/sdg/2.2
"Protect, restore and promote sustainable use of terrestrial ecosystems, sustainably manage forests, combat desertification, and halt and reverse land degradation and halt biodiversity loss",sdg:15,http://metadata.un.org/sdg/15,skos:narrower,http://www.w3.org/2004/02/skos/core#narrower,sdg:15.a,http://metadata.un.org/sdg/15.a
"Fully operationalize the technology bank and science, technology and innovation capacity-building mechanism for least developed countries by 2017 and enhance the use of enabling technology, in particular information and communications technology",sdg:17.8,http://metadata.un.org/sdg/17.8,skos:broader,http://www.w3.org/2004/02/skos/core#broader,sdg:17,http://metadata.un.org/sdg/17
Proportion of local governments that adopt and implement local disaster risk reduction strategies in line with national disaster risk reduction strategies,sdg:C200305,http://metadata.un.org/sdg/C200305,skos:broader,http://www.w3.org/2004/02/skos/core#broader,sdg:13.1,http://metadata.un.org/sdg/13.1
Total official international support (official development assistance plus other official flows) to infrastructure,sdg:C090a01,http://metadata.un.org/sdg/C090a01,sdgo:isIndicatorOf,http://metadata.un.org/sdg/ontology#isIndicatorOf,sdg:9.a,http://metadata.un.org/sdg/9.a
"Strengthen the implementation of the World Health Organization Framework Convention on Tobacco Control in all countries, as appropriate",sdg:3.a,http://metadata.un.org/sdg/3.a,sdgo:hasIndicator,http://metadata.un.org/sdg/ontology#hasIndicator,sdg:C030a01,http://metadata.un.org/sdg/C030a01
"By 2030, ensure universal access to affordable, reliable and modern energy services",sdg:7.1,http://metadata.un.org/sdg/7.1,skos:narrower,http://www.w3.org/2004/02/skos/core#narrower,sdg:C070102,http://metadata.un.org/sdg/C070102
Indicator of food price anomalies,sdg:C020c01,http://metadata.un.org/sdg/C020c01,sdgo:isIndicatorOf,http://metadata.un.org/sdg/ontology#isIndicatorOf,sdg:2.c,http://metadata.un.org/sdg/2.c
Ensure inclusive and equitable quality education and promote lifelong learning opportunities for all,sdg:4,http://metadata.un.org/sdg/4,sdgo:hasTarget,http://metadata.un.org/sdg/ontology#hasTarget,sdg:4.4,http://metadata.un.org/sdg/4.4
"By 2030, substantially increase the number of youth and adults who have relevant skills, including technical and vocational skills, for employment, decent jobs and entrepreneurship",sdg:4.4,http://metadata.un.org/sdg/4.4,sdgo:isTargetOf,http://metadata.un.org/sdg/ontology#isTargetOf,sdg:4,http://metadata.un.org/sdg/4
"Realize timely implementation of duty-free and quota-free market access on a lasting basis for all least developed countries, consistent with World Trade Organization decisions, including by ensuring that preferential rules of origin applicable to imports from least developed countries are transparent and simple, and contribute to facilitating market access",sdg:17.12,http://metadata.un.org/sdg/17.12,skos:narrower,http://www.w3.org/2004/02/skos/core#narrower,sdg:C171201,http://metadata.un.org/sdg/C171201
"Rationalize inefficient fossil-fuel subsidies that encourage wasteful consumption by removing market distortions, in accordance with national circumstances, including by restructuring taxation and phasing out those harmful subsidies, where they exist, to reflect their environmental impacts, taking fully into account the specific needs and conditions of developing countries and minimizing the possible adverse impacts on their development in a manner that protects the poor and the affected communities",sdg:12.c,http://metadata.un.org/sdg/12.c,sdgo:isTargetOf,http://metadata.un.org/sdg/ontology#isTargetOf,sdg:12,http://metadata.un.org/sdg/12
"Enhance North-South, South-South and triangular regional and international cooperation on and access to science, technology and innovation and enhance knowledge-sharing on mutually agreed terms, including through improved coordination among existing mechanisms, in particular at the United Nations level, and through a global technology facilitation mechanism",sdg:17.6,http://metadata.un.org/sdg/17.6,sdgo:hasIndicator,http://metadata.un.org/sdg/ontology#hasIndicator,sdg:C170601,http://metadata.un.org/sdg/C170601
Strengthen the means of implementation and revitalize the Global Partnership for Sustainable Development,sdg:17,http://metadata.un.org/sdg/17,skos:narrower,http://www.w3.org/2004/02/skos/core#narrower,sdg:17.8,http://metadata.un.org/sdg/17.8
"Rationalize inefficient fossil-fuel subsidies that encourage wasteful consumption by removing market distortions, in accordance with national circumstances, including by restructuring taxation and phasing out those harmful subsidies, where they exist, to reflect their environmental impacts, taking fully into account the specific needs and conditions of developing countries and minimizing the possible adverse impacts on their development in a manner that protects the poor and the affected communities",sdg:12.c,http://metadata.un.org/sdg/12.c,skos:narrower,http://www.w3.org/2004/02/skos/core#narrower,sdg:C120c01,http://metadata.un.org/sdg/C120c01
Mobilize and significantly increase financial resources from all sources to conserve and sustainably use biodiversity and ecosystems,sdg:15.a,http://metadata.un.org/sdg/15.a,sdgo:isTargetOf,http://metadata.un.org/sdg/ontology#isTargetOf,sdg:15,http://metadata.un.org/sdg/15
"By 2030, ensure that all girls and boys have access to quality early childhood development, care and pre‑primary education so that they are ready for primary education",sdg:4.2,http://metadata.un.org/sdg/4.2,skos:narrower,http://www.w3.org/2004/02/skos/core#narrower,sdg:C040202,http://metadata.un.org/sdg/C040202
"Minimize and address the impacts of ocean acidification, including through enhanced scientific cooperation at all levels",sdg:14.3,http://metadata.un.org/sdg/14.3,skos:narrower,http://www.w3.org/2004/02/skos/core#narrower,sdg:C140301,http://metadata.un.org/sdg/C140301
Ensure inclusive and equitable quality education and promote lifelong learning opportunities for all,sdg:4,http://metadata.un.org/sdg/4,sdgo:hasTarget,http://metadata.un.org/sdg/ontology#hasTarget,sdg:4.7,http://metadata.un.org/sdg/4.7
Achieve gender equality and empower all women and girls,sdg:5,http://metadata.un.org/sdg/5,sdgo:hasTarget,http://metadata.un.org/sdg/ontology#hasTarget,sdg:5.1,http://metadata.un.org/sdg/5.1
"Dollar value of financial and technical assistance (including through North-South, South‑South and triangular cooperation) committed to developing countries",sdg:C170901,http://metadata.un.org/sdg/C170901,sdgo:isIndicatorOf,http://metadata.un.org/sdg/ontology#isIndicatorOf,sdg:17.9,http://metadata.un.org/sdg/17.9
"Promote peaceful and inclusive societies for sustainable development, provide access to justice for all and build effective, accountable and inclusive institutions at all levels",sdg:16,http://metadata.un.org/sdg/16,skos:narrower,http://www.w3.org/2004/02/skos/core#narrower,sdg:16.7,http://metadata.un.org/sdg/16.7
"By 2020, prohibit certain forms of fisheries subsidies which contribute to overcapacity and overfishing, eliminate subsidies that contribute to illegal, unreported and unregulated fishing and refrain from introducing new such subsidies, recognizing that appropriate and effective special and differential treatment for developing and least developed countries should be an integral part of the World Trade Organization fisheries subsidies negotiation3",sdg:14.6,http://metadata.un.org/sdg/14.6,sdgo:isTargetOf,http://metadata.un.org/sdg/ontology#isTargetOf,sdg:14,http://metadata.un.org/sdg/14
"By 2020, integrate ecosystem and biodiversity values into national and local planning, development processes, poverty reduction strategies and accounts",sdg:15.9,http://metadata.un.org/sdg/15.9,skos:narrower,http://www.w3.org/2004/02/skos/core#narrower,sdg:C150901,http://metadata.un.org/sdg/C150901
Proportion of seats held by women in (a) national parliaments and (b) local governments,sdg:C050501,http://metadata.un.org/sdg/C050501,sdgo:isIndicatorOf,http://metadata.un.org/sdg/ontology#isIndicatorOf,sdg:5.5,http://metadata.un.org/sdg/5.5
Take urgent action to end poaching and trafficking of protected species of flora and fauna and address both demand and supply of illegal wildlife products,sdg:15.7,http://metadata.un.org/sdg/15.7,skos:narrower,http://www.w3.org/2004/02/skos/core#narrower,sdg:C200206,http://metadata.un.org/sdg/C200206
"Mortality rate attributed to unsafe water, unsafe sanitation and lack of hygiene (exposure to unsafe Water, Sanitation and Hygiene for All (WASH) services)",sdg:C030902,http://metadata.un.org/sdg/C030902,sdgo:isIndicatorOf,http://metadata.un.org/sdg/ontology#isIndicatorOf,sdg:3.9,http://metadata.un.org/sdg/3.9
Proportion of wastewater safely treated,sdg:C060301,http://metadata.un.org/sdg/C060301,sdgo:isIndicatorOf,http://metadata.un.org/sdg/ontology#isIndicatorOf,sdg:6.3,http://metadata.un.org/sdg/6.3
"By 2030, substantially reduce the number of deaths and illnesses from hazardous chemicals and air, water and soil pollution and contamination",sdg:3.9,http://metadata.un.org/sdg/3.9,skos:narrower,http://www.w3.org/2004/02/skos/core#narrower,sdg:C030903,http://metadata.un.org/sdg/C030903
"Proportion of population living in cities that implement urban and regional development plans integrating population projections and resource needs, by size of city",sdg:C110a01,http://metadata.un.org/sdg/C110a01,skos:broader,http://www.w3.org/2004/02/skos/core#broader,sdg:11.a,http://metadata.un.org/sdg/11.a
