Label,Subject,Subject URI,Predicate,Predicate URI,Object,Object URI
"Make cities and human settlements inclusive, safe, resilient and sustainable",sdg:11,http://metadata.un.org/sdg/11,sdgo:hasTarget,http://metadata.un.org/sdg/ontology#hasTarget,sdg:11.a,http://metadata.un.org/sdg/11.a
"By 2030, build the resilience of the poor and those in vulnerable situations and reduce their exposure and vulnerability to climate-related extreme events and other economic, social and environmental shocks and disasters",sdg:1.5,http://metadata.un.org/sdg/1.5,sdgo:hasIndicator,http://metadata.un.org/sdg/ontology#hasIndicator,sdg:C010502,http://metadata.un.org/sdg/C010502
"Promote peaceful and inclusive societies for sustainable development, provide access to justice for all and build effective, accountable and inclusive institutions at all levels",sdg:16,http://metadata.un.org/sdg/16,skos:narrower,http://www.w3.org/2004/02/skos/core#narrower,sdg:16.8,http://metadata.un.org/sdg/16.8
"Number of deaths, missing persons and directly affected persons attributed to disasters per 100,000 population",sdg:C200303,http://metadata.un.org/sdg/C200303,sdgo:isIndicatorOf,http://metadata.un.org/sdg/ontology#isIndicatorOf,sdg:11.5,http://metadata.un.org/sdg/11.5
"Conserve and sustainably use the oceans, seas and marine resources for sustainable development",sdg:14,http://metadata.un.org/sdg/14,skos:narrower,http://www.w3.org/2004/02/skos/core#narrower,sdg:14.b,http://metadata.un.org/sdg/14.b
"Direct economic loss in relation to global GDP, damage to critical infrastructure and number of disruptions to basic services, attributed to disasters",sdg:C110502,http://metadata.un.org/sdg/C110502,sdgo:isIndicatorOf,http://metadata.un.org/sdg/ontology#isIndicatorOf,sdg:11.5,http://metadata.un.org/sdg/11.5
"Ensure access to affordable, reliable, sustainable and modern energy for all",sdg:7,http://metadata.un.org/sdg/7,skos:narrower,http://www.w3.org/2004/02/skos/core#narrower,sdg:7.2,http://metadata.un.org/sdg/7.2
"Protect labour rights and promote safe and secure working environments for all workers, including migrant workers, in particular women migrants, and those in precarious employment",sdg:8.8,http://metadata.un.org/sdg/8.8,skos:narrower,http://www.w3.org/2004/02/skos/core#narrower,sdg:C080802,http://metadata.un.org/sdg/C080802
Ensure inclusive and equitable quality education and promote lifelong learning opportunities for all,sdg:4,http://metadata.un.org/sdg/4,skos:narrower,http://www.w3.org/2004/02/skos/core#narrower,sdg:4.b,http://metadata.un.org/sdg/4.b
Number of countries that adopt and implement national disaster risk reduction strategies in line with the Sendai Framework for Disaster Risk Reduction 2015–2030,sdg:C200304,http://metadata.un.org/sdg/C200304,skos:broader,http://www.w3.org/2004/02/skos/core#broader,sdg:13.1,http://metadata.un.org/sdg/13.1
"By 2020, integrate ecosystem and biodiversity values into national and local planning, development processes, poverty reduction strategies and accounts",sdg:15.9,http://metadata.un.org/sdg/15.9,skos:broader,http://www.w3.org/2004/02/skos/core#broader,sdg:15,http://metadata.un.org/sdg/15
"By 2030, enhance inclusive and sustainable urbanization and capacity for participatory, integrated and sustainable human settlement planning and management in all countries",sdg:11.3,http://metadata.un.org/sdg/11.3,sdgo:hasIndicator,http://metadata.un.org/sdg/ontology#hasIndicator,sdg:C110302,http://metadata.un.org/sdg/C110302
Investments in energy efficiency as a proportion of GDP and the amount of foreign direct investment in financial transfer for infrastructure and technology to sustainable development services,sdg:C070b01,http://metadata.un.org/sdg/C070b01,skos:broader,http://www.w3.org/2004/02/skos/core#broader,sdg:7.b,http://metadata.un.org/sdg/7.b
"By 2030, build the resilience of the poor and those in vulnerable situations and reduce their exposure and vulnerability to climate-related extreme events and other economic, social and environmental shocks and disasters",sdg:1.5,http://metadata.un.org/sdg/1.5,sdgo:isTargetOf,http://metadata.un.org/sdg/ontology#isTargetOf,sdg:1,http://metadata.un.org/sdg/1
Achieve gender equality and empower all women and girls,sdg:5,http://metadata.un.org/sdg/5,sdgo:hasTarget,http://metadata.un.org/sdg/ontology#hasTarget,sdg:5.2,http://metadata.un.org/sdg/5.2
"By 2030, end preventable deaths of newborns and children under 5 years of age, with all countries aiming to reduce neonatal mortality to at least as low as 12 per 1,000 live births and under‑5 mortality to at least as low as 25 per 1,000 live births",sdg:3.2,http://metadata.un.org/sdg/3.2,sdgo:isTargetOf,http://metadata.un.org/sdg/ontology#isTargetOf,sdg:3,http://metadata.un.org/sdg/3
"Develop effective, accountable and transparent institutions at all levels",sdg:16.6,http://metadata.un.org/sdg/16.6,sdgo:hasIndicator,http://metadata.un.org/sdg/ontology#hasIndicator,sdg:C160601,http://metadata.un.org/sdg/C160601
"Promote sustained, inclusive and sustainable economic growth, full and productive employment and decent work for all",sdg:8,http://metadata.un.org/sdg/8,sdgo:hasTarget,http://metadata.un.org/sdg/ontology#hasTarget,sdg:8.a,http://metadata.un.org/sdg/8.a
"By 2030, end the epidemics of AIDS, tuberculosis, malaria and neglected tropical diseases and combat hepatitis, water-borne diseases and other communicable diseases",sdg:3.3,http://metadata.un.org/sdg/3.3,skos:narrower,http://www.w3.org/2004/02/skos/core#narrower,sdg:C030305,http://metadata.un.org/sdg/C030305
"Proportion of women and girls aged 15 years and older subjected to sexual violence by persons other than an intimate partner in the previous 12 months, by age and place of occurrence",sdg:C050202,http://metadata.un.org/sdg/C050202,sdgo:isIndicatorOf,http://metadata.un.org/sdg/ontology#isIndicatorOf,sdg:5.2,http://metadata.un.org/sdg/5.2
"Ensure responsive, inclusive, participatory and representative decision-making at all levels",sdg:16.7,http://metadata.un.org/sdg/16.7,skos:broader,http://www.w3.org/2004/02/skos/core#broader,sdg:16,http://metadata.un.org/sdg/16
"Average hourly earnings of female and male employees, by occupation, age and persons with disabilities",sdg:C080501,http://metadata.un.org/sdg/C080501,sdgo:isIndicatorOf,http://metadata.un.org/sdg/ontology#isIndicatorOf,sdg:8.5,http://metadata.un.org/sdg/8.5
"Malaria incidence per 1,000 population",sdg:C030303,http://metadata.un.org/sdg/C030303,skos:broader,http://www.w3.org/2004/02/skos/core#broader,sdg:3.3,http://metadata.un.org/sdg/3.3
Achieve gender equality and empower all women and girls,sdg:5,http://metadata.un.org/sdg/5,skos:narrower,http://www.w3.org/2004/02/skos/core#narrower,sdg:5.6,http://metadata.un.org/sdg/5.6
"Substantially increase health financing and the recruitment, development, training and retention of the health workforce in developing countries, especially in least developed countries and small island developing States",sdg:3.c,http://metadata.un.org/sdg/3.c,sdgo:hasIndicator,http://metadata.un.org/sdg/ontology#hasIndicator,sdg:C030c01,http://metadata.un.org/sdg/C030c01
"By 2030, end hunger and ensure access by all people, in particular the poor and people in vulnerable situations, including infants, to safe, nutritious and sufficient food all year round",sdg:2.1,http://metadata.un.org/sdg/2.1,skos:narrower,http://www.w3.org/2004/02/skos/core#narrower,sdg:C020101,http://metadata.un.org/sdg/C020101
"Protect, restore and promote sustainable use of terrestrial ecosystems, sustainably manage forests, combat desertification, and halt and reverse land degradation and halt biodiversity loss",sdg:15,http://metadata.un.org/sdg/15,skos:narrower,http://www.w3.org/2004/02/skos/core#narrower,sdg:15.5,http://metadata.un.org/sdg/15.5
Extent to which (i) global citizenship education and (ii) education for sustainable development (including climate change education) are mainstreamed in (a) national education policies; (b) curricula; (c) teacher education; and (d) student assessment,sdg:C120801,http://metadata.un.org/sdg/C120801,skos:broader,http://www.w3.org/2004/02/skos/core#broader,sdg:12.8,http://metadata.un.org/sdg/12.8
"Total amount of approved funding for developing countries to promote the development, transfer, dissemination and diffusion of environmentally sound technologies",sdg:C170701,http://metadata.un.org/sdg/C170701,skos:broader,http://www.w3.org/2004/02/skos/core#broader,sdg:17.7,http://metadata.un.org/sdg/17.7
"Number of countries with a national statistical plan that is fully funded and under implementation, by source of funding",sdg:C171803,http://metadata.un.org/sdg/C171803,sdgo:isIndicatorOf,http://metadata.un.org/sdg/ontology#isIndicatorOf,sdg:17.18,http://metadata.un.org/sdg/17.18
Ensure sustainable consumption and production patterns,sdg:12,http://metadata.un.org/sdg/12,sdgo:hasTarget,http://metadata.un.org/sdg/ontology#hasTarget,sdg:12.1,http://metadata.un.org/sdg/12.1
"By 2030, ensure access for all to adequate, safe and affordable housing and basic services and upgrade slums",sdg:11.1,http://metadata.un.org/sdg/11.1,sdgo:hasIndicator,http://metadata.un.org/sdg/ontology#hasIndicator,sdg:C110101,http://metadata.un.org/sdg/C110101
"Make cities and human settlements inclusive, safe, resilient and sustainable",sdg:11,http://metadata.un.org/sdg/11,sdgo:hasTarget,http://metadata.un.org/sdg/ontology#hasTarget,sdg:11.2,http://metadata.un.org/sdg/11.2
"By 2030, substantially reduce waste generation through prevention, reduction, recycling and reuse",sdg:12.5,http://metadata.un.org/sdg/12.5,sdgo:hasIndicator,http://metadata.un.org/sdg/ontology#hasIndicator,sdg:C120501,http://metadata.un.org/sdg/C120501
"By 2030, ensure that all youth and a substantial proportion of adults, both men and women, achieve literacy and numeracy",sdg:4.6,http://metadata.un.org/sdg/4.6,sdgo:hasIndicator,http://metadata.un.org/sdg/ontology#hasIndicator,sdg:C040601,http://metadata.un.org/sdg/C040601
"Prevalence of malnutrition (weight for height >+2 or <-2 standard deviation from the median of the WHO Child Growth Standards) among children under 5 years of age, by type (wasting and overweight)",sdg:C020202,http://metadata.un.org/sdg/C020202,skos:broader,http://www.w3.org/2004/02/skos/core#broader,sdg:2.2,http://metadata.un.org/sdg/2.2
"By 2030, expand infrastructure and upgrade technology for supplying modern and sustainable energy services for all in developing countries, in particular least developed countries, small island developing States and landlocked developing countries, in accordance with their respective programmes of support",sdg:7.b,http://metadata.un.org/sdg/7.b,skos:broader,http://www.w3.org/2004/02/skos/core#broader,sdg:7,http://metadata.un.org/sdg/7
Ensure sustainable consumption and production patterns,sdg:12,http://metadata.un.org/sdg/12,sdgo:hasTarget,http://metadata.un.org/sdg/ontology#hasTarget,sdg:12.8,http://metadata.un.org/sdg/12.8
"By 2020, maintain the genetic diversity of seeds, cultivated plants and farmed and domesticated animals and their related wild species, including through soundly managed and diversified seed and plant banks at the national, regional and international levels, and promote access to and fair and equitable sharing of benefits arising from the utilization of genetic resources and associated traditional knowledge, as internationally agreed",sdg:2.5,http://metadata.un.org/sdg/2.5,sdgo:isTargetOf,http://metadata.un.org/sdg/ontology#isTargetOf,sdg:2,http://metadata.un.org/sdg/2
"By 2020, maintain the genetic diversity of seeds, cultivated plants and farmed and domesticated animals and their related wild species, including through soundly managed and diversified seed and plant banks at the national, regional and international levels, and promote access to and fair and equitable sharing of benefits arising from the utilization of genetic resources and associated traditional knowledge, as internationally agreed",sdg:2.5,http://metadata.un.org/sdg/2.5,skos:narrower,http://www.w3.org/2004/02/skos/core#narrower,sdg:C020501,http://metadata.un.org/sdg/C020501
"End hunger, achieve food security and improved nutrition and promote sustainable agriculture",sdg:2,http://metadata.un.org/sdg/2,skos:narrower,http://www.w3.org/2004/02/skos/core#narrower,sdg:2.c,http://metadata.un.org/sdg/2.c
"Adopt measures to ensure the proper functioning of food commodity markets and their derivatives and facilitate timely access to market information, including on food reserves, in order to help limit extreme food price volatility",sdg:2.c,http://metadata.un.org/sdg/2.c,skos:broader,http://www.w3.org/2004/02/skos/core#broader,sdg:2,http://metadata.un.org/sdg/2
Strengthen the means of implementation and revitalize the Global Partnership for Sustainable Development,sdg:17,http://metadata.un.org/sdg/17,skos:narrower,http://www.w3.org/2004/02/skos/core#narrower,sdg:17.14,http://metadata.un.org/sdg/17.14
"Enhance scientific research, upgrade the technological capabilities of industrial sectors in all countries, in particular developing countries, including, by 2030, encouraging innovation and substantially increasing the number of research and development workers per 1 million people and public and private research and development spending",sdg:9.5,http://metadata.un.org/sdg/9.5,sdgo:hasIndicator,http://metadata.un.org/sdg/ontology#hasIndicator,sdg:C090501,http://metadata.un.org/sdg/C090501
Prevalence of undernourishment,sdg:C020101,http://metadata.un.org/sdg/C020101,skos:broader,http://www.w3.org/2004/02/skos/core#broader,sdg:2.1,http://metadata.un.org/sdg/2.1
"Prevalence of moderate or severe food insecurity in the population, based on the Food Insecurity Experience Scale (FIES)",sdg:C020102,http://metadata.un.org/sdg/C020102,skos:broader,http://www.w3.org/2004/02/skos/core#broader,sdg:2.1,http://metadata.un.org/sdg/2.1
"By 2020, promote the implementation of sustainable management of all types of forests, halt deforestation, restore degraded forests and substantially increase afforestation and reforestation globally",sdg:15.2,http://metadata.un.org/sdg/15.2,skos:broader,http://www.w3.org/2004/02/skos/core#broader,sdg:15,http://metadata.un.org/sdg/15
Proportion of local governments that adopt and implement local disaster risk reduction strategies in line with national disaster risk reduction strategies,sdg:C200305,http://metadata.un.org/sdg/C200305,sdgo:isIndicatorOf,http://metadata.un.org/sdg/ontology#isIndicatorOf,sdg:1.5,http://metadata.un.org/sdg/1.5
"Existence of a developed and operationalized national strategy for youth employment, as a distinct strategy or as part of a national employment strategy",sdg:C080b01,http://metadata.un.org/sdg/C080b01,sdgo:isIndicatorOf,http://metadata.un.org/sdg/ontology#isIndicatorOf,sdg:8.b,http://metadata.un.org/sdg/8.b
"Support the research and development of vaccines and medicines for the communicable and non‑communicable diseases that primarily affect developing countries, provide access to affordable essential medicines and vaccines, in accordance with the Doha Declaration on the TRIPS Agreement and Public Health, which affirms the right of developing countries to use to the full the provisions in the Agreement on Trade-Related Aspects of Intellectual Property Rights regarding flexibilities to protect public health, and, in particular, provide access to medicines for all",sdg:3.b,http://metadata.un.org/sdg/3.b,sdgo:isTargetOf,http://metadata.un.org/sdg/ontology#isTargetOf,sdg:3,http://metadata.un.org/sdg/3
Agricultural export subsidies,sdg:C020b02,http://metadata.un.org/sdg/C020b02,sdgo:isIndicatorOf,http://metadata.un.org/sdg/ontology#isIndicatorOf,sdg:2.b,http://metadata.un.org/sdg/2.b
"Facilitate sustainable and resilient infrastructure development in developing countries through enhanced financial, technological and technical support to African countries, least developed countries, landlocked developing countries and small island developing States",sdg:9.a,http://metadata.un.org/sdg/9.a,skos:broader,http://www.w3.org/2004/02/skos/core#broader,sdg:9,http://metadata.un.org/sdg/9
Ensure universal access to sexual and reproductive health and reproductive rights as agreed in accordance with the Programme of Action of the International Conference on Population and Development and the Beijing Platform for Action and the outcome documents of their review conferences,sdg:5.6,http://metadata.un.org/sdg/5.6,skos:broader,http://www.w3.org/2004/02/skos/core#broader,sdg:5,http://metadata.un.org/sdg/5
Ensure healthy lives and promote well-being for all at all ages,sdg:3,http://metadata.un.org/sdg/3,skos:narrower,http://www.w3.org/2004/02/skos/core#narrower,sdg:3.c,http://metadata.un.org/sdg/3.c
Ensure inclusive and equitable quality education and promote lifelong learning opportunities for all,sdg:4,http://metadata.un.org/sdg/4,sdgo:hasTarget,http://metadata.un.org/sdg/ontology#hasTarget,sdg:4.1,http://metadata.un.org/sdg/4.1
"By 2030, significantly reduce the number of deaths and the number of people affected and substantially decrease the direct economic losses relative to global gross domestic product caused by disasters, including water-related disasters, with a focus on protecting the poor and people in vulnerable situations",sdg:11.5,http://metadata.un.org/sdg/11.5,skos:narrower,http://www.w3.org/2004/02/skos/core#narrower,sdg:C110502,http://metadata.un.org/sdg/C110502
"Increase scientific knowledge, develop research capacity and transfer marine technology, taking into account the Intergovernmental Oceanographic Commission Criteria and Guidelines on the Transfer of Marine Technology, in order to improve ocean health and to enhance the contribution of marine biodiversity to the development of developing countries, in particular small island developing States and least developed countries",sdg:14.a,http://metadata.un.org/sdg/14.a,skos:broader,http://www.w3.org/2004/02/skos/core#broader,sdg:14,http://metadata.un.org/sdg/14
"By 2030, ensure sustainable food production systems and implement resilient agricultural practices that increase productivity and production, that help maintain ecosystems, that strengthen capacity for adaptation to climate change, extreme weather, drought, flooding and other disasters and that progressively improve land and soil quality",sdg:2.4,http://metadata.un.org/sdg/2.4,sdgo:hasIndicator,http://metadata.un.org/sdg/ontology#hasIndicator,sdg:C020401,http://metadata.un.org/sdg/C020401
"Protect labour rights and promote safe and secure working environments for all workers, including migrant workers, in particular women migrants, and those in precarious employment",sdg:8.8,http://metadata.un.org/sdg/8.8,skos:broader,http://www.w3.org/2004/02/skos/core#broader,sdg:8,http://metadata.un.org/sdg/8
Coverage by protected areas of important sites for mountain biodiversity,sdg:C150401,http://metadata.un.org/sdg/C150401,skos:broader,http://www.w3.org/2004/02/skos/core#broader,sdg:15.4,http://metadata.un.org/sdg/15.4
"By 2030, ensure that people everywhere have the relevant information and awareness for sustainable development and lifestyles in harmony with nature",sdg:12.8,http://metadata.un.org/sdg/12.8,sdgo:hasIndicator,http://metadata.un.org/sdg/ontology#hasIndicator,sdg:C120801,http://metadata.un.org/sdg/C120801
"Domestic material consumption, domestic material consumption per capita,  and domestic material consumption per GDP",sdg:C200203,http://metadata.un.org/sdg/C200203,sdgo:isIndicatorOf,http://metadata.un.org/sdg/ontology#isIndicatorOf,sdg:12.2,http://metadata.un.org/sdg/12.2
"Eliminate all harmful practices, such as child, early and forced marriage and female genital mutilation",sdg:5.3,http://metadata.un.org/sdg/5.3,sdgo:hasIndicator,http://metadata.un.org/sdg/ontology#hasIndicator,sdg:C050301,http://metadata.un.org/sdg/C050301
"Proportion of children under 5 years of age whose births have been registered with a civil authority, by age",sdg:C160901,http://metadata.un.org/sdg/C160901,sdgo:isIndicatorOf,http://metadata.un.org/sdg/ontology#isIndicatorOf,sdg:16.9,http://metadata.un.org/sdg/16.9
"By 2030, build the resilience of the poor and those in vulnerable situations and reduce their exposure and vulnerability to climate-related extreme events and other economic, social and environmental shocks and disasters",sdg:1.5,http://metadata.un.org/sdg/1.5,sdgo:hasIndicator,http://metadata.un.org/sdg/ontology#hasIndicator,sdg:C200303,http://metadata.un.org/sdg/C200303
"Eliminate all forms of violence against all women and girls in the public and private spheres, including trafficking and sexual and other types of exploitation",sdg:5.2,http://metadata.un.org/sdg/5.2,sdgo:hasIndicator,http://metadata.un.org/sdg/ontology#hasIndicator,sdg:C050201,http://metadata.un.org/sdg/C050201
"By 2030, reduce the adverse per capita environmental impact of cities, including by paying special attention to air quality and municipal and other waste management",sdg:11.6,http://metadata.un.org/sdg/11.6,sdgo:hasIndicator,http://metadata.un.org/sdg/ontology#hasIndicator,sdg:C110602,http://metadata.un.org/sdg/C110602
"Fixed Internet broadband subscriptions per 100 inhabitants, by speed",sdg:C170602,http://metadata.un.org/sdg/C170602,skos:broader,http://www.w3.org/2004/02/skos/core#broader,sdg:17.6,http://metadata.un.org/sdg/17.6
Achieve gender equality and empower all women and girls,sdg:5,http://metadata.un.org/sdg/5,sdgo:hasTarget,http://metadata.un.org/sdg/ontology#hasTarget,sdg:5.c,http://metadata.un.org/sdg/5.c
"Promote public procurement practices that are sustainable, in accordance with national policies and priorities",sdg:12.7,http://metadata.un.org/sdg/12.7,sdgo:hasIndicator,http://metadata.un.org/sdg/ontology#hasIndicator,sdg:C120701,http://metadata.un.org/sdg/C120701
"Strengthen the prevention and treatment of substance abuse, including narcotic drug abuse and harmful use of alcohol",sdg:3.5,http://metadata.un.org/sdg/3.5,skos:broader,http://www.w3.org/2004/02/skos/core#broader,sdg:3,http://metadata.un.org/sdg/3
"Promote peaceful and inclusive societies for sustainable development, provide access to justice for all and build effective, accountable and inclusive institutions at all levels",sdg:16,http://metadata.un.org/sdg/16,sdgo:hasTarget,http://metadata.un.org/sdg/ontology#hasTarget,sdg:16.4,http://metadata.un.org/sdg/16.4
Mortality rate attributed to unintentional poisoning,sdg:C030903,http://metadata.un.org/sdg/C030903,sdgo:isIndicatorOf,http://metadata.un.org/sdg/ontology#isIndicatorOf,sdg:3.9,http://metadata.un.org/sdg/3.9
"End hunger, achieve food security and improved nutrition and promote sustainable agriculture",sdg:2,http://metadata.un.org/sdg/2,sdgo:hasTarget,http://metadata.un.org/sdg/ontology#hasTarget,sdg:2.4,http://metadata.un.org/sdg/2.4
Proportion of women aged 20–24 years who were married or in a union before age 15 and before age 18,sdg:C050301,http://metadata.un.org/sdg/C050301,skos:broader,http://www.w3.org/2004/02/skos/core#broader,sdg:5.3,http://metadata.un.org/sdg/5.3
"By 2020, achieve the environmentally sound management of chemicals and all wastes throughout their life cycle, in accordance with agreed international frameworks, and significantly reduce their release to air, water and soil in order to minimize their adverse impacts on human health and the environment",sdg:12.4,http://metadata.un.org/sdg/12.4,sdgo:isTargetOf,http://metadata.un.org/sdg/ontology#isTargetOf,sdg:12,http://metadata.un.org/sdg/12
"Proportion of businesses that had at least one contact with a public official and that paid a bribe to a public official, or were asked for a bribe by those public officials during the previous 12 months",sdg:C160502,http://metadata.un.org/sdg/C160502,sdgo:isIndicatorOf,http://metadata.un.org/sdg/ontology#isIndicatorOf,sdg:16.5,http://metadata.un.org/sdg/16.5
"By 2030, significantly reduce illicit financial and arms flows, strengthen the recovery and return of stolen assets and combat all forms of organized crime",sdg:16.4,http://metadata.un.org/sdg/16.4,skos:narrower,http://www.w3.org/2004/02/skos/core#narrower,sdg:C160402,http://metadata.un.org/sdg/C160402
"By 2020, protect and restore water-related ecosystems, including mountains, forests, wetlands, rivers, aquifers and lakes",sdg:6.6,http://metadata.un.org/sdg/6.6,sdgo:isTargetOf,http://metadata.un.org/sdg/ontology#isTargetOf,sdg:6,http://metadata.un.org/sdg/6
"By 2030, ensure that all girls and boys have access to quality early childhood development, care and pre‑primary education so that they are ready for primary education",sdg:4.2,http://metadata.un.org/sdg/4.2,sdgo:hasIndicator,http://metadata.un.org/sdg/ontology#hasIndicator,sdg:C040202,http://metadata.un.org/sdg/C040202
"Total amount of approved funding for developing countries to promote the development, transfer, dissemination and diffusion of environmentally sound technologies",sdg:C170701,http://metadata.un.org/sdg/C170701,sdgo:isIndicatorOf,http://metadata.un.org/sdg/ontology#isIndicatorOf,sdg:17.7,http://metadata.un.org/sdg/17.7
"By 2030, ensure the conservation of mountain ecosystems, including their biodiversity, in order to enhance their capacity to provide benefits that are essential for sustainable development",sdg:15.4,http://metadata.un.org/sdg/15.4,sdgo:hasIndicator,http://metadata.un.org/sdg/ontology#hasIndicator,sdg:C150402,http://metadata.un.org/sdg/C150402
Average marine acidity (pH) measured at agreed suite of representative sampling stations,sdg:C140301,http://metadata.un.org/sdg/C140301,skos:broader,http://www.w3.org/2004/02/skos/core#broader,sdg:14.3,http://metadata.un.org/sdg/14.3
